{"datasetId":"azurian-isles-0.3.1","encoding":"x-y-ranges-v1","levels":[{"columns":[{"x":0,"yRanges":[[0,0]]}],"z":0},{"columns":[{"x":0,"yRanges":[[0,0]]}],"z":1},{"columns":[{"x":0,"yRanges":[[0,0]]}],"z":2},{"columns":[{"x":0,"yRanges":[[0,1]]},{"x":1,"yRanges":[[0,1]]}],"z":3},{"columns":[{"x":0,"yRanges":[[0,2]]},{"x":1,"yRanges":[[0,2]]},{"x":2,"yRanges":[[0,2]]}],"z":4},{"columns":[{"x":0,"yRanges":[[1,5]]},{"x":1,"yRanges":[[0,5]]},{"x":2,"yRanges":[[0,5]]},{"x":3,"yRanges":[[0,4]]},{"x":4,"yRanges":[[0,4]]},{"x":5,"yRanges":[[0,4]]}],"z":5},{"columns":[{"x":0,"yRanges":[[3,8]]},{"x":1,"yRanges":[[2,10]]},{"x":2,"yRanges":[[0,10]]},{"x":3,"yRanges":[[0,10]]},{"x":4,"yRanges":[[0,10]]},{"x":5,"yRanges":[[0,10]]},{"x":6,"yRanges":[[0,8]]},{"x":7,"yRanges":[[1,8]]},{"x":8,"yRanges":[[1,8]]},{"x":9,"yRanges":[[0,9]]},{"x":10,"yRanges":[[1,8]]},{"x":11,"yRanges":[[1,8]]}],"z":6},{"columns":[{"x":0,"yRanges":[[9,14]]},{"x":1,"yRanges":[[7,17]]},{"x":2,"yRanges":[[4,21]]},{"x":3,"yRanges":[[4,21]]},{"x":4,"yRanges":[[2,21]]},{"x":5,"yRanges":[[1,21]]},{"x":6,"yRanges":[[1,21]]},{"x":7,"yRanges":[[0,20]]},{"x":8,"yRanges":[[0,20]]},{"x":9,"yRanges":[[0,20]]},{"x":10,"yRanges":[[1,16],[18,20]]},{"x":11,"yRanges":[[1,15]]},{"x":12,"yRanges":[[1,16]]},{"x":13,"yRanges":[[1,16]]},{"x":14,"yRanges":[[2,16]]},{"x":15,"yRanges":[[2,17]]},{"x":16,"yRanges":[[2,17]]},{"x":17,"yRanges":[[2,17]]},{"x":18,"yRanges":[[1,18]]},{"x":19,"yRanges":[[1,18]]},{"x":20,"yRanges":[[2,17]]},{"x":21,"yRanges":[[2,17]]},{"x":22,"yRanges":[[3,4],[6,6],[9,17]]},{"x":23,"yRanges":[[10,16]]}],"z":7}],"schemaVersion":1,"snapshotId":"az:azurian-isles-0.3.1:2dfc3f15e3605b29","tileCount":552,"tilePyramidId":"azurian-isles-0.3.1.basemap"}
