{"datasetId":"dragonstar-26.09","encoding":"x-y-ranges-v1","levels":[{"columns":[{"x":0,"yRanges":[[0,0]]}],"z":0},{"columns":[{"x":0,"yRanges":[[0,0]]}],"z":1},{"columns":[{"x":0,"yRanges":[[0,0]]}],"z":2},{"columns":[{"x":0,"yRanges":[[0,1]]},{"x":1,"yRanges":[[0,1]]}],"z":3},{"columns":[{"x":0,"yRanges":[[0,2]]},{"x":1,"yRanges":[[0,2]]},{"x":2,"yRanges":[[0,2]]}],"z":4},{"columns":[{"x":0,"yRanges":[[0,3]]},{"x":1,"yRanges":[[0,4]]},{"x":2,"yRanges":[[0,5]]},{"x":3,"yRanges":[[0,5]]},{"x":4,"yRanges":[[1,5]]},{"x":5,"yRanges":[[2,3]]}],"z":5},{"columns":[{"x":0,"yRanges":[[3,5]]},{"x":1,"yRanges":[[1,6]]},{"x":2,"yRanges":[[0,7]]},{"x":3,"yRanges":[[0,8]]},{"x":4,"yRanges":[[0,9]]},{"x":5,"yRanges":[[1,10]]},{"x":6,"yRanges":[[1,10]]},{"x":7,"yRanges":[[2,10]]},{"x":8,"yRanges":[[3,10]]},{"x":9,"yRanges":[[4,10]]},{"x":10,"yRanges":[[4,6]]}],"z":6},{"columns":[{"x":0,"yRanges":[[7,10]]},{"x":1,"yRanges":[[7,10]]},{"x":2,"yRanges":[[3,10]]},{"x":3,"yRanges":[[2,13]]},{"x":4,"yRanges":[[1,14]]},{"x":5,"yRanges":[[0,14]]},{"x":6,"yRanges":[[0,14]]},{"x":7,"yRanges":[[0,17]]},{"x":8,"yRanges":[[0,18]]},{"x":9,"yRanges":[[3,18]]},{"x":10,"yRanges":[[3,20]]},{"x":11,"yRanges":[[3,20]]},{"x":12,"yRanges":[[3,20]]},{"x":13,"yRanges":[[5,20]]},{"x":14,"yRanges":[[5,20]]},{"x":15,"yRanges":[[6,21]]},{"x":16,"yRanges":[[6,21]]},{"x":17,"yRanges":[[6,21]]},{"x":18,"yRanges":[[9,21]]},{"x":19,"yRanges":[[9,12]]},{"x":20,"yRanges":[[9,12]]},{"x":21,"yRanges":[[9,9],[11,12]]}],"z":7}],"schemaVersion":1,"snapshotId":"shotn:dragonstar-26.09:fc161d3df4b24cab","tileCount":410,"tilePyramidId":"dragonstar-26.09.basemap"}
