{"datasetId":"abecean-shores-25.05a","encoding":"x-y-ranges-v1","levels":[{"columns":[{"x":0,"yRanges":[[0,0]]}],"z":0},{"columns":[{"x":0,"yRanges":[[0,0]]}],"z":1},{"columns":[{"x":0,"yRanges":[[0,0]]}],"z":2},{"columns":[{"x":0,"yRanges":[[0,1]]},{"x":1,"yRanges":[[0,1]]}],"z":3},{"columns":[{"x":0,"yRanges":[[0,2]]},{"x":1,"yRanges":[[0,2]]},{"x":2,"yRanges":[[0,2]]},{"x":3,"yRanges":[[1,2]]}],"z":4},{"columns":[{"x":0,"yRanges":[[0,5]]},{"x":1,"yRanges":[[0,5]]},{"x":2,"yRanges":[[0,5]]},{"x":3,"yRanges":[[0,5]]},{"x":4,"yRanges":[[1,5]]},{"x":5,"yRanges":[[2,5]]},{"x":6,"yRanges":[[2,5]]},{"x":7,"yRanges":[[2,5]]}],"z":5},{"columns":[{"x":0,"yRanges":[[0,10]]},{"x":1,"yRanges":[[0,10]]},{"x":2,"yRanges":[[0,10]]},{"x":3,"yRanges":[[0,10]]},{"x":4,"yRanges":[[0,10]]},{"x":5,"yRanges":[[1,10]]},{"x":6,"yRanges":[[1,10]]},{"x":7,"yRanges":[[1,10]]},{"x":8,"yRanges":[[3,10]]},{"x":9,"yRanges":[[4,10]]},{"x":10,"yRanges":[[4,10]]},{"x":11,"yRanges":[[4,10]]},{"x":12,"yRanges":[[4,10]]},{"x":13,"yRanges":[[4,10]]},{"x":14,"yRanges":[[4,10]]},{"x":15,"yRanges":[[9,10]]}],"z":6},{"columns":[{"x":0,"yRanges":[[0,20]]},{"x":1,"yRanges":[[0,20]]},{"x":2,"yRanges":[[0,20]]},{"x":3,"yRanges":[[0,20]]},{"x":4,"yRanges":[[0,20]]},{"x":5,"yRanges":[[0,20]]},{"x":6,"yRanges":[[0,20]]},{"x":7,"yRanges":[[0,20]]},{"x":8,"yRanges":[[0,20]]},{"x":9,"yRanges":[[0,20]]},{"x":10,"yRanges":[[2,20]]},{"x":11,"yRanges":[[2,21]]},{"x":12,"yRanges":[[3,21]]},{"x":13,"yRanges":[[3,21]]},{"x":14,"yRanges":[[3,21]]},{"x":15,"yRanges":[[6,21]]},{"x":16,"yRanges":[[6,20]]},{"x":17,"yRanges":[[8,20]]},{"x":18,"yRanges":[[8,20]]},{"x":19,"yRanges":[[8,20]]},{"x":20,"yRanges":[[8,20]]},{"x":21,"yRanges":[[8,20]]},{"x":22,"yRanges":[[8,20]]},{"x":23,"yRanges":[[8,20]]},{"x":24,"yRanges":[[8,20]]},{"x":25,"yRanges":[[8,20]]},{"x":26,"yRanges":[[8,20]]},{"x":27,"yRanges":[[9,20]]},{"x":28,"yRanges":[[9,20]]},{"x":29,"yRanges":[[9,21]]},{"x":30,"yRanges":[[18,20]]},{"x":31,"yRanges":[[18,20]]}],"z":7}],"schemaVersion":1,"snapshotId":"pc:abecean-shores-25.05a:d595b962dbc6c23e","tileCount":706,"tilePyramidId":"abecean-shores-25.05a.basemap"}
