{"datasetId":"poison-song-26.08","encoding":"x-y-ranges-v1","levels":[{"columns":[{"x":0,"yRanges":[[0,0]]}],"z":0},{"columns":[{"x":0,"yRanges":[[0,1]]},{"x":1,"yRanges":[[0,1]]}],"z":1},{"columns":[{"x":0,"yRanges":[[0,2]]},{"x":1,"yRanges":[[0,2]]},{"x":2,"yRanges":[[0,2]]}],"z":2},{"columns":[{"x":0,"yRanges":[[0,1],[3,3]]},{"x":1,"yRanges":[[0,5]]},{"x":2,"yRanges":[[0,5]]},{"x":3,"yRanges":[[0,4]]},{"x":4,"yRanges":[[0,4]]}],"z":3},{"columns":[{"x":0,"yRanges":[[0,2],[6,7]]},{"x":1,"yRanges":[[0,3],[6,7]]},{"x":2,"yRanges":[[0,10]]},{"x":3,"yRanges":[[0,11]]},{"x":4,"yRanges":[[0,11]]},{"x":5,"yRanges":[[0,9]]},{"x":6,"yRanges":[[0,8]]},{"x":7,"yRanges":[[0,8]]},{"x":8,"yRanges":[[1,8]]},{"x":9,"yRanges":[[1,2],[4,6]]}],"z":4},{"columns":[{"x":0,"yRanges":[[1,4]]},{"x":1,"yRanges":[[1,4],[13,14]]},{"x":2,"yRanges":[[1,6],[12,14]]},{"x":3,"yRanges":[[2,7],[12,15]]},{"x":4,"yRanges":[[3,16],[19,21]]},{"x":5,"yRanges":[[1,16],[19,21]]},{"x":6,"yRanges":[[1,22]]},{"x":7,"yRanges":[[1,22]]},{"x":8,"yRanges":[[1,22]]},{"x":9,"yRanges":[[1,22]]},{"x":10,"yRanges":[[1,18]]},{"x":11,"yRanges":[[0,16]]},{"x":12,"yRanges":[[0,14]]},{"x":13,"yRanges":[[1,16]]},{"x":14,"yRanges":[[1,16]]},{"x":15,"yRanges":[[2,16]]},{"x":16,"yRanges":[[2,16]]},{"x":17,"yRanges":[[2,16]]},{"x":18,"yRanges":[[2,5],[9,13]]},{"x":19,"yRanges":[[2,5],[10,12]]}],"z":5},{"columns":[{"x":0,"yRanges":[[3,7]]},{"x":1,"yRanges":[[2,9]]},{"x":2,"yRanges":[[3,9]]},{"x":3,"yRanges":[[2,9],[27,29]]},{"x":4,"yRanges":[[2,8],[26,29]]},{"x":5,"yRanges":[[2,12],[24,29]]},{"x":6,"yRanges":[[4,5],[8,12],[24,29]]},{"x":7,"yRanges":[[7,14],[24,30]]},{"x":8,"yRanges":[[6,17],[24,30],[38,39]]},{"x":9,"yRanges":[[6,32],[38,42]]},{"x":10,"yRanges":[[4,32],[38,43]]},{"x":11,"yRanges":[[3,32],[38,43]]},{"x":12,"yRanges":[[3,33],[35,36],[38,43]]},{"x":13,"yRanges":[[3,44]]},{"x":14,"yRanges":[[3,45]]},{"x":15,"yRanges":[[3,45]]},{"x":16,"yRanges":[[3,45]]},{"x":17,"yRanges":[[3,45]]},{"x":18,"yRanges":[[3,45]]},{"x":19,"yRanges":[[2,45]]},{"x":20,"yRanges":[[2,36]]},{"x":21,"yRanges":[[2,36]]},{"x":22,"yRanges":[[2,33]]},{"x":23,"yRanges":[[0,32]]},{"x":24,"yRanges":[[0,29]]},{"x":25,"yRanges":[[0,2],[4,28]]},{"x":26,"yRanges":[[3,28]]},{"x":27,"yRanges":[[3,32]]},{"x":28,"yRanges":[[3,32]]},{"x":29,"yRanges":[[3,32]]},{"x":30,"yRanges":[[5,32]]},{"x":31,"yRanges":[[5,32]]},{"x":32,"yRanges":[[5,32]]},{"x":33,"yRanges":[[5,32]]},{"x":34,"yRanges":[[5,11],[13,33]]},{"x":35,"yRanges":[[5,11],[18,26],[30,32]]},{"x":36,"yRanges":[[5,11],[18,26]]},{"x":37,"yRanges":[[5,10],[20,25]]},{"x":38,"yRanges":[[5,10],[21,25]]}],"z":6},{"columns":[{"x":0,"yRanges":[[10,15]]},{"x":1,"yRanges":[[6,15]]},{"x":2,"yRanges":[[5,17]]},{"x":3,"yRanges":[[5,19]]},{"x":4,"yRanges":[[6,19]]},{"x":5,"yRanges":[[6,19]]},{"x":6,"yRanges":[[6,18]]},{"x":7,"yRanges":[[5,18],[55,58]]},{"x":8,"yRanges":[[6,17],[54,59]]},{"x":9,"yRanges":[[5,17],[53,59]]},{"x":10,"yRanges":[[5,17],[19,23],[49,59]]},{"x":11,"yRanges":[[7,24],[49,59]]},{"x":12,"yRanges":[[8,10],[16,24],[48,59]]},{"x":13,"yRanges":[[16,25],[48,59]]},{"x":14,"yRanges":[[16,27],[48,60]]},{"x":15,"yRanges":[[15,28],[48,61]]},{"x":16,"yRanges":[[13,29],[48,61]]},{"x":17,"yRanges":[[13,34],[48,61],[76,78]]},{"x":18,"yRanges":[[13,42],[48,63],[76,80]]},{"x":19,"yRanges":[[13,64],[76,85]]},{"x":20,"yRanges":[[11,64],[76,86]]},{"x":21,"yRanges":[[9,64],[76,86]]},{"x":22,"yRanges":[[8,64],[76,86]]},{"x":23,"yRanges":[[6,64],[76,86]]},{"x":24,"yRanges":[[6,65],[76,86]]},{"x":25,"yRanges":[[6,67],[71,72],[76,87]]},{"x":26,"yRanges":[[6,88]]},{"x":27,"yRanges":[[6,89]]},{"x":28,"yRanges":[[6,90]]},{"x":29,"yRanges":[[6,91]]},{"x":30,"yRanges":[[7,91]]},{"x":31,"yRanges":[[7,91]]},{"x":32,"yRanges":[[7,91]]},{"x":33,"yRanges":[[7,91]]},{"x":34,"yRanges":[[7,91]]},{"x":35,"yRanges":[[7,91]]},{"x":36,"yRanges":[[7,91]]},{"x":37,"yRanges":[[7,91]]},{"x":38,"yRanges":[[4,91]]},{"x":39,"yRanges":[[4,72],[83,89]]},{"x":40,"yRanges":[[4,72]]},{"x":41,"yRanges":[[4,72]]},{"x":42,"yRanges":[[4,72]]},{"x":43,"yRanges":[[4,71]]},{"x":44,"yRanges":[[4,67]]},{"x":45,"yRanges":[[4,67]]},{"x":46,"yRanges":[[4,65]]},{"x":47,"yRanges":[[1,59]]},{"x":48,"yRanges":[[0,58]]},{"x":49,"yRanges":[[0,4],[9,58]]},{"x":50,"yRanges":[[0,4],[9,57]]},{"x":51,"yRanges":[[8,57]]},{"x":52,"yRanges":[[7,57]]},{"x":53,"yRanges":[[7,57]]},{"x":54,"yRanges":[[7,58]]},{"x":55,"yRanges":[[7,64]]},{"x":56,"yRanges":[[7,64]]},{"x":57,"yRanges":[[7,64]]},{"x":58,"yRanges":[[7,64]]},{"x":59,"yRanges":[[7,64]]},{"x":60,"yRanges":[[11,64]]},{"x":61,"yRanges":[[11,64]]},{"x":62,"yRanges":[[11,64]]},{"x":63,"yRanges":[[11,64]]},{"x":64,"yRanges":[[11,64]]},{"x":65,"yRanges":[[11,64]]},{"x":66,"yRanges":[[11,64]]},{"x":67,"yRanges":[[11,20],[26,64]]},{"x":68,"yRanges":[[11,22],[26,66]]},{"x":69,"yRanges":[[11,23],[36,53],[60,66]]},{"x":70,"yRanges":[[11,23],[36,53],[60,64]]},{"x":71,"yRanges":[[11,23],[36,53]]},{"x":72,"yRanges":[[11,23],[36,53]]},{"x":73,"yRanges":[[11,22],[38,53]]},{"x":74,"yRanges":[[11,21],[40,51]]},{"x":75,"yRanges":[[11,20],[40,51]]},{"x":76,"yRanges":[[11,20],[43,51]]},{"x":77,"yRanges":[[11,20]]}],"z":7}],"schemaVersion":1,"snapshotId":"tr:poison-song-26.08:6964517551e0fcb0","tileCount":5464,"tilePyramidId":"poison-song-26.08.basemap"}
