{"datasetId":"original-goty-hd","encoding":"x-y-ranges-v1","levels":[{"columns":[{"x":0,"yRanges":[[0,0]]}],"z":0},{"columns":[{"x":0,"yRanges":[[0,0]]}],"z":1},{"columns":[{"x":0,"yRanges":[[0,1]]},{"x":1,"yRanges":[[0,1]]}],"z":2},{"columns":[{"x":0,"yRanges":[[0,1]]},{"x":1,"yRanges":[[0,2]]},{"x":2,"yRanges":[[0,2]]},{"x":3,"yRanges":[[1,2]]}],"z":3},{"columns":[{"x":0,"yRanges":[[0,1]]},{"x":1,"yRanges":[[0,2]]},{"x":2,"yRanges":[[0,5]]},{"x":3,"yRanges":[[0,5]]},{"x":4,"yRanges":[[0,5]]},{"x":5,"yRanges":[[0,5]]},{"x":6,"yRanges":[[2,5]]}],"z":4},{"columns":[{"x":0,"yRanges":[[0,3]]},{"x":1,"yRanges":[[0,3]]},{"x":2,"yRanges":[[0,4]]},{"x":3,"yRanges":[[0,5]]},{"x":4,"yRanges":[[2,10]]},{"x":5,"yRanges":[[0,10]]},{"x":6,"yRanges":[[0,11]]},{"x":7,"yRanges":[[0,11]]},{"x":8,"yRanges":[[0,11]]},{"x":9,"yRanges":[[0,11]]},{"x":10,"yRanges":[[1,11]]},{"x":11,"yRanges":[[2,11]]},{"x":12,"yRanges":[[4,10]]}],"z":5},{"columns":[{"x":0,"yRanges":[[0,5]]},{"x":1,"yRanges":[[0,7]]},{"x":2,"yRanges":[[0,7]]},{"x":3,"yRanges":[[0,6]]},{"x":4,"yRanges":[[0,6]]},{"x":5,"yRanges":[[0,9]]},{"x":6,"yRanges":[[1,2],[5,10]]},{"x":7,"yRanges":[[5,11]]},{"x":8,"yRanges":[[4,14]]},{"x":9,"yRanges":[[4,21]]},{"x":10,"yRanges":[[2,21]]},{"x":11,"yRanges":[[0,21]]},{"x":12,"yRanges":[[0,21]]},{"x":13,"yRanges":[[0,22]]},{"x":14,"yRanges":[[0,22]]},{"x":15,"yRanges":[[1,22]]},{"x":16,"yRanges":[[1,22]]},{"x":17,"yRanges":[[1,23]]},{"x":18,"yRanges":[[1,23]]},{"x":19,"yRanges":[[1,23]]},{"x":20,"yRanges":[[3,22]]},{"x":21,"yRanges":[[3,22]]},{"x":22,"yRanges":[[5,22]]},{"x":23,"yRanges":[[7,22]]},{"x":24,"yRanges":[[9,20]]},{"x":25,"yRanges":[[10,20]]}],"z":6},{"columns":[{"x":0,"yRanges":[[5,10]]},{"x":1,"yRanges":[[1,10]]},{"x":2,"yRanges":[[0,12]]},{"x":3,"yRanges":[[0,14]]},{"x":4,"yRanges":[[1,14]]},{"x":5,"yRanges":[[1,14]]},{"x":6,"yRanges":[[1,13]]},{"x":7,"yRanges":[[0,13]]},{"x":8,"yRanges":[[1,12]]},{"x":9,"yRanges":[[0,12]]},{"x":10,"yRanges":[[0,12],[14,18]]},{"x":11,"yRanges":[[2,19]]},{"x":12,"yRanges":[[3,5],[11,19]]},{"x":13,"yRanges":[[11,20]]},{"x":14,"yRanges":[[11,22]]},{"x":15,"yRanges":[[10,23]]},{"x":16,"yRanges":[[8,24]]},{"x":17,"yRanges":[[8,29]]},{"x":18,"yRanges":[[8,37]]},{"x":19,"yRanges":[[8,42]]},{"x":20,"yRanges":[[6,42]]},{"x":21,"yRanges":[[4,42]]},{"x":22,"yRanges":[[3,42]]},{"x":23,"yRanges":[[1,42]]},{"x":24,"yRanges":[[1,42]]},{"x":25,"yRanges":[[1,42]]},{"x":26,"yRanges":[[1,43]]},{"x":27,"yRanges":[[1,45]]},{"x":28,"yRanges":[[1,45]]},{"x":29,"yRanges":[[1,45]]},{"x":30,"yRanges":[[2,45]]},{"x":31,"yRanges":[[2,45]]},{"x":32,"yRanges":[[2,45]]},{"x":33,"yRanges":[[2,45]]},{"x":34,"yRanges":[[2,46]]},{"x":35,"yRanges":[[2,47]]},{"x":36,"yRanges":[[2,47]]},{"x":37,"yRanges":[[2,46]]},{"x":38,"yRanges":[[2,46]]},{"x":39,"yRanges":[[5,46]]},{"x":40,"yRanges":[[6,45]]},{"x":41,"yRanges":[[6,45]]},{"x":42,"yRanges":[[6,45]]},{"x":43,"yRanges":[[10,45]]},{"x":44,"yRanges":[[11,45]]},{"x":45,"yRanges":[[14,44]]},{"x":46,"yRanges":[[15,44]]},{"x":47,"yRanges":[[17,40]]},{"x":48,"yRanges":[[18,40]]},{"x":49,"yRanges":[[18,40]]},{"x":50,"yRanges":[[20,40]]},{"x":51,"yRanges":[[21,40]]}],"z":7}],"schemaVersion":1,"snapshotId":"original:goty:8b2690c0ce1c954e","tileCount":2114,"tilePyramidId":"original-goty-hd.basemap"}
